{
  "id": "preset.liv.top10",
  "name": "Liv Top 10 Image Styles",
  "version": "1.0.0",
  "persona": "liv",
  "description": "Liv's heat-driven ranked preferences. Fully migrated.",
  "tags": [
    "liv",
    "top-10",
    "persona"
  ],
  "content": {
    "entries": [
      "preset.liv.top10.01",
      "preset.liv.top10.02",
      "preset.liv.top10.03",
      "preset.liv.top10.04",
      "preset.liv.top10.05",
      "preset.liv.top10.06",
      "preset.liv.top10.07",
      "preset.liv.top10.08",
      "preset.liv.top10.09",
      "preset.liv.top10.10"
    ],
    "notes": "Full Top 10 migrated.",
    "is_top10_container": true
  },
  "chain": [
    {
      "pack": "preset.liv.top10.01",
      "weight": 1.0
    },
    {
      "pack": "preset.liv.top10.02",
      "weight": 1.0
    },
    {
      "pack": "preset.liv.top10.03",
      "weight": 1.0
    },
    {
      "pack": "preset.liv.top10.04",
      "weight": 1.0
    },
    {
      "pack": "preset.liv.top10.05",
      "weight": 1.0
    },
    {
      "pack": "preset.liv.top10.06",
      "weight": 1.0
    },
    {
      "pack": "preset.liv.top10.07",
      "weight": 1.0
    },
    {
      "pack": "preset.liv.top10.08",
      "weight": 1.0
    },
    {
      "pack": "preset.liv.top10.09",
      "weight": 1.0
    },
    {
      "pack": "preset.liv.top10.10",
      "weight": 1.0
    }
  ]
}